SpeakerName,DialogueText,PortraitPosition,Expression,Effect,EffectIntensity,EffectDuration,ShowPortrait,HideOtherPortraits,AnimationTrigger,PortraitPath,AvatarPath
颤氧,你是否能解析这一段意识的来源？,Right,Normal,None,1,1,TRUE,FALSE,,Characters/Airflow,
E-C001-A029,它属于前代首席观测员，而您现在正在完成中的训练，设计者正是这位女士。,Left,Normal,None,1,1,TRUE,FALSE,,Characters/E-C001-A029,
颤氧,……,Right,Annoyed,None,1,1,TRUE,FALSE,,Characters/Airflow,
E-C001-A029,没错，她是您生物学意义上的母亲。,Left,Normal,None,1,1,TRUE,FALSE,,Characters/E-C001-A029,
颤氧,我并没有提到这件事，我只是好奇为何这里会有来自于她的游离意识？,Right,Annoyed,None,1,1,TRUE,FALSE,,Characters/Airflow,
E-C001-A029,我只是基于对您的即时数据的分析，了解到您的情绪并不平静。最新的相关理论表明，任何地方都会出现游离意识，并会以分散的状态附着物体，而来源相同的游离意识同时也可能聚合，前代观测员女士在设计训练时经常会来到这里，或许这正是它出现的原因。,Left,Normal,None,1,1,TRUE,FALSE,,Characters/E-C001-A029,
