SpeakerName,DialogueText,PortraitPosition,Expression,Effect,EffectIntensity,EffectDuration,ShowPortrait,HideOtherPortraits,AnimationTrigger,PortraitPath,AvatarPath
E-C001-A029,观测员女士，现在我将向您说明超意识操作的基本机制。,Center,Normal,None,1,1,TRUE,TRUE,,Characters/E-C001-A029,
E-C001-A029,按下 <b>Q键</b> 即可进入选择模式，您将能够清晰感知并选定可交互的意识构成物。,Center,Normal,None,1,1,TRUE,TRUE,,Characters/E-C001-A029,
E-C001-A029,再次按下 <b>Q键</b> 可退出选择模式，请根据任务需要灵活切换。,Center,Normal,None,1,1,TRUE,TRUE,,Characters/E-C001-A029,
E-C001-A029,当您处于选择模式中时，靠近两个意识构成物并按下 <b>E键</b>，即可执行位置互换操作。,Center,Normal,None,1,1,TRUE,TRUE,,Characters/E-C001-A029,
E-C001-A029,请注意，仅当两个目标都处于激活状态且结构稳定时，交换才会成功。,Center,Normal,None,1,1,TRUE,TRUE,,Characters/E-C001-A029,
E-C001-A029,现在我已经帮您按好了 <b>Q键</b>，请选择一个您想尝试互换的对象吧。,Center,Normal,None,1,1,TRUE,TRUE,,Characters/E-C001-A029,
